{
  "schemaVersion": "5.0",
  "containerType": "all-presets",
  "exportId": "export-synthetic-run-12000",
  "manifest": {
    "createdAt": "1970-01-01T00:00:12.000Z",
    "encoding": "inline-json",
    "contentIndex": {
      "reportTypes": [
        "cutted",
        "false-success",
        "old-answer",
        "empty",
        "prompt-not-sent",
        "late-end"
      ],
      "modelIds": [
        "GPT"
      ],
      "eventCount": 19
    },
    "reportSchemas": {
      "cutted": "2.2.0",
      "false-success": "2.2.0",
      "old-answer": "2.2.0",
      "empty": "2.2.0",
      "prompt-not-sent": "2.2.0",
      "late-end": "2.2.0"
    },
    "deduplication": {
      "canonicalEventsStoredOnce": true,
      "embeddedReportsContainEventSeqsOnly": true
    },
    "privacyMode": "metadata-only",
    "sizeBudgetBytes": 1000000,
    "overflowPolicy": [
      "drop-rebuildable-derived-detail",
      "externalize-optional-attachments",
      "aggregate-repeated-checks",
      "preserve-canonical-proof-events"
    ],
    "omissions": []
  },
  "crossReportCompatibility": {
    "mode": "same_export",
    "exactMatch": {
      "runSessionId": "synthetic-run",
      "ledgerHash": "sha256:c01f1486c084535af8c36d85b8b07d0e4a1ab1dd98cdee350b0df291779dd523",
      "ledgerCompleteThroughSeq": 19
    }
  },
  "sharedConfig": {
    "extensionVersion": "2.81.149",
    "generationWaitProfile": "unknown",
    "schemaVersion": "5.0",
    "generatorVersion": "proof-export@1.3.0",
    "policy": {
      "policyId": "proof-default-v1",
      "automaticMinimumEvidenceTier": 3,
      "maximumSignalSkewMs": 250
    },
    "privacy": {
      "mode": "metadata-only",
      "rawPromptAnswerExported": false,
      "urlMode": "hash-only"
    },
    "dependencyRegistry": {
      "registryVersion": "5.0.0",
      "predicateLanguageVersion": "1.0.0",
      "maxEscalationDepth": 2,
      "reports": {
        "cutted": {
          "question": "Почему зафиксирован SUCCESS, а текст явно неполный?",
          "applicability": {
            "all": [
              [
                "$.derivedViews.terminalOutcome",
                "eq",
                "SUCCESS"
              ],
              [
                "$.derivedViews.incompleteCaptureEvidence",
                "eq",
                true
              ]
            ]
          },
          "slots": [
            [
              "success_terminal",
              "critical",
              [
                "MODEL_TERMINAL_RECORDED"
              ]
            ],
            [
              "text_evolution",
              "critical",
              [
                "TEXT_STATE_CHANGED"
              ]
            ],
            [
              "completeness",
              "critical",
              [
                "ANSWER_COMPLETENESS_EVALUATED",
                "POST_TERMINAL_AUDIT_COMPLETED"
              ]
            ],
            [
              "extraction_boundary",
              "required",
              [
                "EXTRACTION_COMPLETED",
                "STRUCTURAL_VERIFICATION_EVALUATED"
              ]
            ],
            [
              "candidate_identity",
              "required",
              [
                "CANDIDATE_SET_CHANGED",
                "CANDIDATE_IDENTITY_INFERRED"
              ]
            ],
            [
              "decision_lineage",
              "required",
              [
                "DECISION_RECORDED"
              ]
            ],
            [
              "finalization_policy",
              "conditional",
              [
                "FINALIZATION_POLICY_EVALUATED",
                "POLICY_OVERRIDE_APPLIED"
              ],
              [
                "$.stateAxes.terminalMode",
                "in",
                [
                  "forced",
                  "recovery"
                ]
              ]
            ],
            [
              "missing_evidence",
              "conditional",
              [
                "MISSING_EVIDENCE_RECORDED"
              ]
            ]
          ]
        },
        "false-success": {
          "question": "Почему система решила «готово», а ответ продолжил расти?",
          "applicability": {
            "all": [
              [
                "$.derivedViews.terminalOutcome",
                "eq",
                "SUCCESS"
              ],
              [
                "$.derivedViews.postTerminalAuditStatus",
                "eq",
                "completed"
              ],
              [
                "$.derivedViews.postTerminalGrowthProven",
                "eq",
                true
              ]
            ]
          },
          "slots": [
            [
              "success_terminal",
              "critical",
              [
                "MODEL_TERMINAL_RECORDED"
              ]
            ],
            [
              "post_terminal_audit",
              "critical",
              [
                "POST_TERMINAL_AUDIT_COMPLETED"
              ]
            ],
            [
              "terminal_decision",
              "required",
              [
                "DECISION_RECORDED"
              ]
            ],
            [
              "generation_state",
              "required",
              [
                "GENERATION_SIGNAL_CHANGED",
                "OBSERVATION_FRAME_CAPTURED"
              ]
            ],
            [
              "post_terminal_mutation",
              "required",
              [
                "TEXT_STATE_CHANGED"
              ]
            ],
            [
              "completion_proof",
              "conditional",
              [
                "COMPLETION_HYPOTHESIS_EVALUATED",
                "ANSWER_COMPLETENESS_EVALUATED"
              ],
              [
                "$.stateAxes.terminalMode",
                "eq",
                "automatic"
              ]
            ],
            [
              "finalization_policy",
              "conditional",
              [
                "TERMINAL_DEADLINE_REACHED",
                "FINALIZATION_POLICY_EVALUATED",
                "POLICY_OVERRIDE_APPLIED"
              ],
              [
                "$.stateAxes.terminalMode",
                "in",
                [
                  "forced",
                  "recovery"
                ]
              ]
            ],
            [
              "missing_evidence",
              "conditional",
              [
                "MISSING_EVIDENCE_RECORDED"
              ]
            ]
          ]
        },
        "old-answer": {
          "question": "Почему принят текст от предыдущего запроса?",
          "applicability": {
            "all": [
              [
                "$.derivedViews.oldAnswerEvidence",
                "eq",
                true
              ]
            ]
          },
          "slots": [
            [
              "dispatch_baseline",
              "critical",
              [
                "DISPATCH_BASELINE_CAPTURED"
              ]
            ],
            [
              "candidate_identity",
              "critical",
              [
                "CANDIDATE_IDENTITY_INFERRED"
              ]
            ],
            [
              "extraction_result",
              "critical",
              [
                "EXTRACTION_COMPLETED"
              ]
            ],
            [
              "accepted_answer_boundary",
              "critical",
              [
                "MODEL_TERMINAL_RECORDED"
              ]
            ],
            [
              "candidate_lineage",
              "required",
              [
                "CANDIDATE_SET_CHANGED"
              ]
            ],
            [
              "turn_context",
              "required",
              [
                "PAGE_CONTEXT_OBSERVED",
                "OBSERVATION_FRAME_CAPTURED"
              ]
            ],
            [
              "structural_verification",
              "required",
              [
                "STRUCTURAL_VERIFICATION_EVALUATED"
              ]
            ],
            [
              "text_boundary",
              "conditional",
              [
                "TEXT_STATE_CHANGED"
              ]
            ],
            [
              "post_terminal_audit",
              "conditional",
              [
                "POST_TERMINAL_AUDIT_COMPLETED",
                "MISSING_EVIDENCE_RECORDED"
              ]
            ]
          ]
        },
        "empty": {
          "question": "Почему генерация была, но extraction вернул пусто или не тот узел?",
          "applicability": {
            "all": [
              [
                "$.derivedViews.generationTextObserved",
                "eq",
                true
              ],
              [
                "$.derivedViews.extractionProblemEvidence",
                "eq",
                true
              ]
            ]
          },
          "slots": [
            [
              "generation_observed",
              "critical",
              [
                "GENERATION_START_EVALUATED",
                "GENERATION_SIGNAL_CHANGED"
              ]
            ],
            [
              "extraction_result",
              "critical",
              [
                "EXTRACTION_COMPLETED"
              ]
            ],
            [
              "candidate_selection",
              "critical",
              [
                "CANDIDATE_SET_CHANGED",
                "CANDIDATE_IDENTITY_INFERRED"
              ]
            ],
            [
              "text_boundary",
              "critical",
              [
                "TEXT_STATE_CHANGED",
                "OBSERVATION_FRAME_CAPTURED"
              ]
            ],
            [
              "structural_verification",
              "required",
              [
                "STRUCTURAL_VERIFICATION_EVALUATED",
                "ANSWER_COMPLETENESS_EVALUATED"
              ]
            ],
            [